CODE,NAME,AMOUNT,DATE,REPNAME,MARK,BALANCE
GH10001,CEMANDON COMPANY LTD(WATER REGION),15800,2025/5/20,徐亮,PICK UP MOMO,305288.74
GH10004,NIMOK(TUDU),4760,2024/6/26,KUMBALA,PICKUP CREDIT ESTHER Y,9795.5
GH10006,COASTAL BATTERY (TESANO),5000,2026/2/9,PRINCE B,SHOP CREDIT PRINCE B,5000
GH10007,SUPER O ENT (TEMA),18260,2025/7/3,BENEDICTA,"BENEDICTA, SEND TO SHOP EVERY 2 WEEKS",2048
GH10009,KMENS ENT (TEMA),12000,2026/2/11,BENEDICTA,"PICK UP CASH,BENY(Q)",57607
GH10010,JABPAH ENT (TEMA),116778.3,2026/1/22,BENEDICTA,"BENEDICTA,SEND TO SHOP ON CREDIT",101239.55
GH10013,MR.B MOTORS (TEMA),39956,2025/10/14,BENEDICTA,SHOP CREDIT BENNY,28918
GH10015,YAW NSIAH BATTERY (TECHIMAN),4045,2023/7/14,KUMBALA,pay mmo today and pic kup,4310
GH10019,MR.JONES (TAKORADI),75411,2026/2/13,KUMBALA,"KUMBALA,SEND TO STATION ON CREDIT",75411
GH10025,AVETOS AUTO PARTS (TAIFA JUNCTION),2667.3,2026/1/24,AKORFA,PICK UP CASH AKORFA,129438.8
GH10026,NANA K.VENTURES(TAIFA JUNCTION),22400,2025/11/5,PRINCE B,SHOP CHEQUES OBENG,10801.56
GH10027,PK ASSAN ENTERPRISE(SWERDU),76882.2,2026/2/14,ESTHER YEBOAH,PICK UP CREDIT ESTHER Y,309618.54
GH10028,ODO NKOA ENTERPRISE (SWEDRU),6550,2026/2/10,ESTHER YEBOAH,PICK UP CASH STEPHAINE,22010.3
GH10032,KAFKUM,,,BENEDICTA,,4745
GH10033,OHENEBA BATTERY(NKAWKAW ),5250,2026/2/5,PRINCE B,"LATIFA,PICK UP ON CREDIT",66142.3
GH10034,GYAMFI MOTORS BATTERY (NKAWKAW),34580.5,2026/1/7,BENEDICTA,PICK UP CREDIT BENNY,851
GH10035,NEW TOWN GEORGE (NEW TOWN),126000,2026/1/29,PRINCE B,SHOP CREDIT,227229.6
GH10037,SEY SERVICES & SUPPLY (MATAHEKO MASS ROAD),4210,2025/9/12,PRINCE B,SHOP,9604
GH10038,RED J MOTOR (MADINA),72289.75,2026/1/22,AKORFA,SHOP CREDIT AKORFA,168887.23
GH10039,GREAT MAJESTY BATTERY (MADINA),44200,2025/10/14,AKORFA,SHOP WEEKLY ESTHER Y,58308
GH10041,EKUFUL KOBBY AND FRIENDS SPARE PARTS(MADINA),89870,2026/2/17,AKORFA,SHOP CREDIT SABINA,49229.18
GH10042,MIC-MAY ENT (MADINA),8320,2026/1/26,AKORFA,SEND TO SHOP ON CREDIT,249292.9
GH10043,MANNAN ENTERPRISE (MADINA),2460,2026/1/14,ESTHER YEBOAH,PICK UP CASH WAREHOSUE,514029.82
GH10050,TITANUIM BATTERY (KUMASI),600,2025/12/6,徐亮,"PICK UP CASH,MARVIN",600.74
GH10051,DAVID GYAMFI MOTORS (KUMASI),14400,2026/2/17,徐亮,STATION CREDIT （客户投诉价格过高于市场价）,548538.97
GH10052,SAMUEL OPOKU MENSAH BATTERY (KUMASI),77520,2026/1/10,KOFI,SEND TO STATION PAID 10w CHEQUE,593218.6
GH10053,ALPHA AUTO PARTS (KUMASI),6300,2026/2/5,KOFI,SEND TO STAION ON CREDIT,316310.63
GH10057,MESSIAH HIGHEST (KUMASI),95460,2026/1/26,KOFI,SEND TO STATION ON CREDIT,319147
GH10059,JONPE,,,KOFI,,17845.9
GH10062,JONES,,,KOFI,,3485
GH10063,WORSHIP MOTORS (KUMASI),4594,2023/1/30,ENOCH,"PICKUP,GOT THE CASH",601
GH10064,YAW OPPONG AUTO PARTS (KUMASI),163397,2025/9/7,KOFI,SEND TO STATION ADD 10 COATS,131862.1
GH10067,D.NTIAMOA (KUMASI),27700,2026/1/15,KOFI,"KOFI,SEND TO STATION PAY CHEQUE",29838
GH10068,AKWASI ACHEAMPONG (KUMASI),10620,2026/2/17,KOFI,PICK UP MOMO LATIFA,100185.02
GH10069,MARANATHA AUTO PARTS (KUMASI),14831.2,2025/11/11,KOFI,TO STATION CREDIT 买十送一 MARVIN,18035.7
GH10074,AZAY ENTERPRISES (KUMASI),10110,2025/6/17,ENOCH,TAFO STATION CASH,1000
GH10075,NANA OSEI/ISAAC AFRIYIE ENTERPRISE (KUMASI),19135,2025/8/7,KOFI,TAFO STATION CASH 李,135
GH10076,MISS K VENTURES (KPONE),2380,2025/6/30,AMOAH HILDA,PICK UP CASH,6840
GH10082,GOOD FATHER ENT (KOKOMPE),12150,2026/1/7,PRINCE B,TO SHOP CASH MARVIN,96411
GH10084,ALEX BOAT SPARE (KOFORIDUA),2570.5,2026/2/13,PRINCE B,PICK UP CASH PRINCE B,184987.66
GH10085,DE SABKU MOTORS ENT (KOFORIDUA),2420,2026/1/26,PRINCE B,SHOP CASH PRINCE B,45067.9
GH10086,BY HIS GRACE MOTORS (KOFORIDUA),29540,2026/2/17,PRINCE B,PICK UP ON CREDIT,215973.11
GH10087,BIG BRO ENT (KOFORIDUA),8910,2025/12/16,PRINCE B,"PRINCE B, SEND TO STATION WEEKLY CASH",4405
GH10088,ETP ENTERPRISE (KASOA),1890.5,2026/2/9,ESTHER YEBOAH,SHOP CREDIT ESTHER Y,1406663.67
GH10089,DADA RICH BATTERY (KASOA),14200,2026/1/27,KUMBALA,SHOP CHEQUES KUMBALA 旧电池促销,85977
GH10093,ESEPET THE LORD (CAPE COAST),298110,2025/12/29,KUMBALA,SEND TO STATION MONTHLY PAYMENT,409229.4
GH10094,ABAKAFORD ENT (CAPE COAST),940,2026/1/31,KUMBALA,"HANNA,SEND TO STATION PAY MOMO",268204
GH10095,SASCO MOTORS (AVENOR),7100,2026/2/13,AKORFA,PICK UP CREDIT LATIFA,55911.4
GH10096,AMAYAA VENTURES (AVENOR),8950,2025/12/18,AKORFA,"LATIFA,SEND TO SHOP PAY CASH",3900
GH10099,TWO PLUS TWO BATTERY (ASHAIMAN),103960,2026/1/20,BENEDICTA,"BENEDICTA,SEND TO SHOP ON CREDIT",103962.4
GH10102,OFORI JONES (AMASAMA),3700,2023/5/26,BENEDICTA,pick up,2462
GH10105,ONE BRAKE HOUSE (ALAJO),800,2026/2/4,PRINCE B,PICK UP CREDIT LATIFA,59778.34
GH10106,KWAKU-AKUA,4400,2026/2/12,商宇琛,PICK UP CHEQUE LATIFA,350329.5
GH10107,GEORGE NYARKO VENTURES BATTERY (ACHIMOTA),456,2025/3/24,PRINCE B,SHOP CASH SAMPLE,3896
GH10108,FRANK OSWSU MOTORS (ACHIMOTA),2100,2026/2/12,PRINCE B,PICK UP CASH PRINCE B,153206.76
GH10109,DOUBLE ROAD FATHER BATTERY (ABOSSEY OKAI),72650,2025/7/3,朱立刚,TO SHOP CREDIT,28401.55
GH10110,BOAKOMEA MOTORS (ABOSSEY OKAI),1310,2026/1/29,朱立刚,TO SHOP CASH LEO,270408.75
GH10111,LESLIE AUTOMOBILE (ABOSSEY OKAI),4480,2022/9/19,朱立刚,"GOT CASH,PICKUP",98148.5
GH10112,BATURE ENTERPRISE (ABOSSEY OKAI),3736,2026/2/16,商宇琛,PICK UP CREDIT,418154
GH10113,ASEDA HOUSE MOTORS BATTERY (ABOSSEY OKAI),31200,2024/1/17,朱立刚,"SNED TO SHOP,CREDIT",123308.06
GH10114,AB ACHEMPIO MOTORS (ABOSSEY OKAI),140000,2026/2/3,BOATEMAA ABIGAIL,"TO SHOP CHEQUE,ABI",189864.5
GH10116,AYENSU AUTO PARTS (ABOSSEY OKAI),1400,2026/2/11,朱立刚,PICK UP CREDIT,290254.22
GH10117,CHAIRMAN BASE AUTO PARTS (ABOSSEY OKAI),32217,2026/1/28,朱立刚,TO SHOP CREDIT,157081.24
GH101176,PHOENIX MOTORS(KOFORIDUA),8660,2026/2/9,PRINCE B,PICK UP WEEKLY P;RINCE B,8660
GH10119,BIG FRIENDS MOTORS (ABOSSEY OKAI),27600,2026/2/12,BOATEMAA ABIGAIL,SEND TO SHOP CREDIT ABI,77380
GH10120,XIANO AUTO PARTS (ABOSSEY OKAI),3182,2026/2/9,朱立刚,SEND TO SHOP MOTOR RIDER,114379.6
GH10121,ANAMBON JOSEPH MOTORS,,,BENY,,71164
GH10122,FORDAM ENTERPRISES LTD (ABOSSEY OKAI),840,2023/11/22,AMOAH HILDA,CASH SEND TO SHOP,4000
GH10123,OFORI BA OFORI MOTORS (ABOSSEY OKAI),53000,2025/12/9,BOATEMAA ABIGAIL,"TO SHOP CREDIT,ABI",55100.15
GH10124,REPLACEMENT AUTO PARTS (ABOSSEY OKAI),32800,2026/2/9,商宇琛,PICK UP CASH TO LINDA,312865.32
GH10125,PASM 91 MOTORS (ABOSSEY OKAI),48353,2025/3/5,AMOAH HILDA,TO SHOP EVERY WEEK 4000 CASH,711.8
GH10127,DOUBLE ROAD ERIC BATTERY (ABOSSEY OKAI),390,2025/7/10,PRINCE,PICK UP CASH,2598
GH10130,CASE DIE MOTORS (ABOSSEY OKAI),1156,2022/6/16,BENY,补单，货已发,40867
GH10131,MAKENZY VENTURES(ABOSSEY OKAI),12300,2022/5/17,AMOAH HILDA,,18414.5
GH10132,FAMASCO ENT (ABOSSEY OKAI),15635,2024/7/24,PRINCE,PICK UP CASH BENY,19939
GH10134,OHENEBA SIDOUG (ABOSSEY OKAI),1450,2026/2/17,朱立刚,SEND TO SHOP MOTOR RIDER CREDIT,90844
GH10135,PATELA MOTORS (ABOSSEY OKAI),73866,2024/12/3,AMOAH HILDA,TO SHOP CHEQUE,152460.5
GH10136,SANODA VENTURES ENT (ABOSSEY OKAI),36556,2026/1/19,PRINCE,TO SHOP CREDIT,0.4
GH10137,KWESAPP VENTURES (ABOSSEY OKAI),630,2024/7/9,AMOAH HILDA,PICKUP CASH STEPHANIE,33443.2
GH10138,ABOVE ALL AUTO PARTS (ABOSSEY OKAI),4950,2026/2/17,AMOAH HILDA,"TO SHOP CREDIT,HILDA",3524
GH10140,JONYARK MOTORS (ABOSSEY OKAI),825,2026/2/13,PRINCE,"PICK UP CASH,PRINCE",825
GH10142,LOVERS AND BEST FRIENDS ENT (ABOSSEY OKAI),4600,2025/11/27,BENY,PICK UP CASH BENY,4600
GH10143,SAFANT ENTERPRISE,,,BENY,,11471
GH10144,FRANBETO ENT (ABOSSEY OKAI),25365,2026/1/19,朱立刚,SEND TO SHOP CREDIT 10000 EVERY WEEK,263212.5
GH10145,KWAKU SAAH MOTORS (ABOSSEY OKAI),12066,2026/2/9,AMOAH HILDA,SEND TO SHOP CASH HILDA,77172.6
GH10147,QUALIPARTS ENTERPRISE (ABOSSEY OKAI),7420,2026/1/6,PRINCE,"TO SHOP CHEQUE,ABI",58688
GH10148,DACOSTA B.FRIENDS MOTORS (ABOSSEY OKAI),14380,2025/11/21,PRINCE,TO SHOP CHEQUE PRICE,9428
GH10150,BEGORO AUTO PARTS (ABOSSEY OKAI),132348,2024/11/18,PRINCE,TO SHOP CREDIT FOR ONE MONTH,443919.86
GH10153,MERCOM AUTO PARTS (ABOSSEY OKAI),7275,2026/2/5,LINDA,"PICK UP CREDIT,STEPHANIE",18731
GH10155,K.BOADU AUTO MOBILE SPARE PARTS (ABOSSEY OKAI),43860,2025/6/20,AMOAH HILDA,TO SHOP CASH EVERY WEEK,85557
GH10156,EYE ADOM MOTORS (ABOSSEY OKAI),5930,2025/10/6,AMOAH HILDA,SHOP CREDIT HILDA,2496
GH10157,ENO MOTORS (ABOSSEY OKAI),940,2022/12/6,BENY,,4848
GH10158,ALEX ENTERPRISE (ABOSSEY OKAI),1740,2024/6/26,AMOAH HILDA,PICKUP,21435
GH10162,PADDY MOTORS (ABOSSEY OKAI),40420,2026/2/11,PRINCE,SEND TO SHOP 20000CASH + CREDIT 4 week,22328.26
GH10163,LADY ROSEMARY ENTERPRISE (ABOSSEY OKAI),900,2026/1/12,PRINCE,"TO SHOP CREDIT,PRINCE",15350
GH10164,OBIRISCO MOTORS (ABOSSEY OKAI),11850,2026/1/29,LINDA,SEND TO SHOP CHEQUE PRINCE,38849.2
GH10168,NABO MOTORS (ABOSSEY OKAI),7250,2026/1/21,朱立刚,TO SHOP CASH7000  ESTHER CA,3000
GH10169,APINDE ENT (ABOSSEY OKAI),2150,2025/5/23,AMOAH HILDA,"PICK UP MOMO,BENY",13935
GH10171,YELLOW MAN ENT (ABOSSEY OKAI),5210,2025/11/6,PRINCE,SEND TO SHOP CREDIT HALF CASH TODAY +NEXT WEEK PAY ALL HILDA,800
GH10172,SHOCK HOUSE (ABOSSEY OKAI),27280,2025/1/6,AMOAH HILDA,SEND TO SHOP 20000 CASH TODAY + 7280 NEXT WEEK,13370
GH10173,HANNANUELLA RADIATOR (ABOSSEY OKAI),800,2026/2/12,AMOAH HILDA,PICK UP CREDIT,30827.5
GH10174,KAY MONIC BATTERY,,,BENEDICTA,,11580
GH10175,ONE K.MOTORS (ABOSSEY OKAI),27020,2026/2/11,LINDA,TO SHOP CREDIT,27020
GH10176,KAMFO YEHOWA(ABOSSEY OKAI),7290,2025/8/6,LINDA,"TO SHOP CREDIT,BENY",17130.6
GH10177,ASOMDWEE ENT BATTERY (ABOSSEY OKAI),10500,2025/9/1,AMOAH HILDA,SHOP CASH 10000 BENY,5500
GH10178,DOE MOTORS (ABOSSEY OKAI),6500,2025/12/15,PRINCE,TO SHOP CHEQUE,6171
GH10180,SHAMOO ENT (ABOSSEY OKAI),17304,2026/1/29,PRINCE,"TO SHOP EVERY WEEK 2K,PRINCE",13303.55
GH10181,BOAKING MOTORS (ABOSSEY OKAI),17226,2025/6/13,PRINCE,SEND TO SHOP 5000CASH + CHEQUE,2741
GH10184,AMSCO MOTORS (ABOSSEY OKAI),4725,2026/2/10,PRINCE,"TO SHOP REPLACE RETURNS,ABI",94982
GH10186,MARO PARTS (ABOSSEY OKAI),1415,2023/9/18,AMOAH HILDA,MARO补单,2618
GH10187,NEW MAN (ABOSSEY OKAI),3620,2026/2/14,AMOAH HILDA,"TO SHOP CASH,HILDA",24121.68
GH10188,CALL OUT ENT (ABOSSEY OKAI),8680,2026/2/12,AMOAH HILDA,"TO SHOP CHEQUE,HILDA",8680
GH10189,KINGDOM AUTOPARTS,,,AMOAH HILDA,,12545
GH10190,FIRST ADVENTURE ENT(ABOSSEY OKAI),4710,2024/11/13,AMOAH HILDA,PICK UP CASH BENY,1244
GH10191,HAYFORD MOTORS (ABOSSEY OKAI),2050,2026/2/13,PRINCE,PICK UP CASH PRINCE,19308
GH10193,OSOPRINCE ENT (ABOSSEY OKAI),7795,2025/7/8,PRINCE,"O SHOP CREDIT,LINDA",3795
GH10194,ABOSSEY OKAI FRANK,20600,2025/2/19,PRINCE,10K TODAY BALANCE NEXT WEEK,10950
GH10202,AKAPELLA MOTORS,,,BENY,,6429
GH10203,CABOAT AGENCY (ABOSSEY OKAI),2675,2025/12/29,PRINCE,"TO SHOP CHEQUE,HILDA",500
GH10209,ABOSSEY NANA YAW,44688,2026/2/13,AMOAH HILDA,"TO SHOP PAY 20K CASH,REST WITHIN MONTH,HILDA",64708
GH10212,BIZZACO CAR QUEST (ABOSSEY OKAI),1180,2024/10/10,BENY,pick up cash,6697.81
GH10213,ISAAC OFORI BOATING (ABOSSEY OKAI),16030,2025/10/3,AMOAH HILDA,TO SHOP CASH BENYT,7960
GH10214,TONY’S ENGINE MOUNTINGS,1500,2023/9/12,PRINCE,明天付一半,1090
GH10216,J AND T VENTURES(ABOSSEY OKAI),17580,2025/7/23,AMOAH HILDA,PICK UP 10K CASH+REST NEXT WEEK THUR BENY,7580
GH10218,LIVING BROTHER MOTORS (ABOSSEY OKAI),4168,2025/8/30,AMOAH HILDA,"PICK UP CASH,BENY",4168
GH10227,BETTER MOTORS (ABOSSEY OKAI),29238,2025/6/27,AMOAH HILDA,TO SHOP CASH15K REST NEXT WEEK BENY,26238
GH10232,ADUANA MOTORS (ABOSSEY OKAI),20495,2026/1/16,PRINCE,SEND TO SHOP pay all in 6 weeks,21469
GH10233,RANS O VENTURES (KUMASI),8990,2026/2/13,KOFI,SEND TO STATION PAY CHEQUE,432597.84
GH10235,PAAKWESI MOTORS (ABOSSEY AKAI),2600,2026/1/27,AMOAH HILDA,SEND TO SHOP CASH ABI,8155.75
GH10236,ABOO BELT (ABOSSEY OKAI),5340,2025/1/22,AMOAH HILDA,PICK UP CASH,18583
GH10237,KOSADA MOTORS (ABOSSEY OKAI),1650,2024/10/11,AMOAH HILDA,TO SHOP CASH,2693.94
GH10238,PK BATTERY(LAPAZ),95800,2024/2/6,AKORFA,TO SHOP CREDIT,95800
GH10242,YOUNG AUTO MOBILE PARTS (ABOSSEY OKAI),7360,2025/5/19,AMOAH HILDA,"PICK UP CASH,BENY",4743
GH10252,JONATHAN ANNING BATTERY (DOME),22300,2025/9/1,AKORFA,"SYLVIA, PICK UP ON CREDIT",5210
GH10260,LIZZY MOTORS (KOKOMPE),2280,2026/1/31,PRINCE B,PICK UP CASH PRINCE B,3744
GH10266,TWUM BARIMA ENT(ABOSSEY OKAI),3060,2026/2/12,AMOAH HILDA,"TO SHOP CHEQUE,HILDA",12108.8
GH10270,SAFORO ENT(ABOSSERY OKAI),13125,2025/11/26,AMOAH HILDA,PICK UP CASH BENY,6430
GH10271,BEKOE COMMERCIL(ABOSSEY OKAI),12180,2025/6/11,AMOAH HILDA,PICK UP CASH,46118.04
GH10274,SEFA WILLIAM MOTORS(TEMA),12089.7,2026/2/13,BENEDICTA,"BENEDICTA,PICK UP PAY CASH,到办公室付现金，带2件工衣",17602.7
GH10275,TAYLOR MOTORS(TAYLOR),3275,2026/1/5,AMOAH HILDA,PICK UP MOMO STEPHNIE,562
GH10276,OMARISCO AUTO PARTS(ABOSSEY OKAI),6550,2026/2/12,AMOAH HILDA,PICK UP CHEQUE HILDA,9918
GH10284,AMERICANO GASKET(ABOSSEY OKAI),3300,2025/4/2,PRINCE,PICK UP CASH BENY,2
GH10295,M MOTORS(ABOSSEY OKAI),4146,2025/7/24,AMOAH HILDA,"PICK UP CASH,BENY",146
GH10299,ADAMS BELT HOUSE(ABOSSEY OKAI),16020,2025/4/9,LINDA,TO SHOP CASH+CHEQUE LINDA,5020
GH10301,ABU TAHIRU MOHAMMED (ASHAIMAN),9700,2026/2/11,BENEDICTA,"PICK UP CREDIT,BENY(Q)",303320.6
GH10304,TEYE DJAMGBAH (TEMA),730,2026/2/12,BENEDICTA,PICK UP CASH HANNAH,40401.98
GH10306,DORIS KUMASI,32250,2026/1/19,KOFI,STATION CREDIT 李,32230
GH10307,YEBOAH RADIATOR (ABOSSEY OKAI),11980,2026/2/12,PRINCE,PICK UP CASH PRINCE,193097
GH10311,PACTUM(ABOSSEY OKAI),16645.2,2025/5/31,AMOAH HILDA,PIC UP CASH,0.2
GH10312,GYAMFI AUTO PARTS(ABOSSEY OKAI),12530,2025/11/7,AMOAH HILDA,"TO SHOP PAID 4K CASH REST CREDIT,ABI",5530.4
GH10313,ANTWI ENTERPRISE(ABOSSEY OKAI),22170,2023/11/22,BENY,现金 pick up,28531
GH10315,ALIMAYS MOTOR(KOFORIDUA),2554,2026/2/13,PRINCE B,"LATIFA,PICK UP PAY MOMO,已转账MOMO",53627.87
GH10318,ACHISCO(ABOSSEY OKAI),788,2026/2/9,PRINCE,PICK UP CASH PRINCE,836
GH10325,NATHANIEL(KUMASI),1680,2026/2/9,KOFI,STATION MOMO 徐,36695.29
GH10328,YEBFORD RADIATOR(ABOSSEY OKAI),5500,2026/2/18,朱立刚,SEND TO SHOP CREDIT,426928.75
GH10345,KOFOO MOTORS,2670,2026/2/12,AMOAH HILDA,"TO SHOP CASH,HILDA",36572.26
GH10349,OBO BA MOTORS(AMASAMA),13750,2025/9/20,PRINCE B,"PICK UP CASH,STEPHANIE",8112
GH10351,PAZASH(ABOSSEY OKAI),1202,2026/2/9,PRINCE,PICK UP MOMO STEPHAINE,2866
GH10352,FRANK BOTWE(ABOSSEY OKAI),2685,2025/2/25,PRINCE,PICK UP CASH,13164
GH10356,QUANSAH AUTO PARTS (ABOSSEY OKAI),2296,2026/1/29,LINDA,SEND TO SHOP CASH PRINCE,976
GH10368,ENINFUL MOTORS(ABOSSEY OKAI),10000,2026/2/16,AMOAH HILDA,SEND TO SHOP CHEQUE,210551.5
GH10393,KWAKYE-BO ENTERPRISE (ABOSSEY OKAI),3575,2024/3/11,AMOAH HILDA,CASH PICK UP,575
GH10394,DIO ENTERPRICE (ABOSSEY OKAI),34582,2025/5/6,PRINCE,SEND TO SHOP CASH,16622
GH10396,KOFI LINKS MOTORS,1940,2023/7/5,PRINCE,send to shop and cash tomorrow,2650
GH10405,JAMJOSE COMPANY LTD (CAPE COAST),5512,2025/12/30,KUMBALA,STATION CASH AKORFA,12
GH10409,YELLOW MAN (MADINA),52380,2026/2/3,AKORFA,SHOP CHEQUES AKORFA,215483.05
GH10416,SAFE JOURNEY MOTORS,15600,2025/12/11,AMOAH HILDA,PICK UP CASH SABINA,5600
GH10423,DIVINE THOMAS (ABOSSEY OKAI),18350,2024/10/2,AMOAH HILDA,TO SHOP 6000CASH+CHEQUE,5250
GH10435,GENUINE MOTORS(ABOSSEY OKAI),7410,2023/10/26,BENY,pay cheque and send to shop,5310
GH10447,AGYENGO ELECTRICALS（ACCRA）,,,PRINCE B,,750
GH10457,DIESEL MOTORS(ABOSSEY OKAI),71024,2025/10/10,LINDA,TO SHOP CHEQUES LINDA,7570
GH10460,REINCHEMAT ENTERPRISE(ACCRA),,,PRINCE B,,1120
GH10461,EYE NYAME ENT (MADINA),,,AKORFA,,400
GH10479,MAYUS AUTO ENT(UPPER WEST REGION WA),73768,2026/1/22,商宇琛,SEND TO SATTION 20000 PREPAID + 10000 TOMORROW +EVERY WEEK 10000,161104
GH10522,KORAMAUD AUTO PARTS(LAMP),476,2025/7/17,朱立刚,PICK UP CASH,63000
GH10525,DOKISS ENT（ACCRA UTC）,,,PRINCE B,,1500
GH10533,JOEYEB(KASOA),900,2024/10/11,KUMBALA,PICK UP CASH,2800
GH10581,ROYAL CRYSTAL(OMAR PLAZA ACCRA),,,PRINCE B,,2970
GH10585,PETER BOAKYE(KUMASI),29920,2025/3/17,KOFI,STATION CASH 12000,12490
GH10593,BIG 40 ENT(ABOSSEY OKAI),18200,2026/2/3,LINDA,"TO SHOP CHEQUE,LINDA",35350
GH10620,CLUTCH HOUSE(MADINA),838,2026/1/30,AKORFA,"STEPHAINE,PICK UP PAY MOMO",1309.5
GH10650,GAREK ENT(BATTERY AND TYRE),10150,2026/1/26,BENEDICTA,SHOP EACH 2 WEEKS BENNY,9500
GH10674,IKE DAN ENT(ABOSSEY OKAI),43400,2022/12/16,AMOAH HILDA,,4019
GH10719,OBAA YAA (KUMASI),13900,2025/11/3,ENOCH,SEND TO STATION ON CREIDT,6360
GH10736,OKYENA  ENT ASHAIMAN,215340,2025/4/29,BENEDICTA,SEND TO SHOP CREDIT,5473
GH10758,KPABIYA ENTERPRISE(KUMASI),1360,2022/10/28,KOFI,,36258
GH10759,KING OWUEFFA KUMASI,27240,2026/2/17,KOFI,STATION CREDIT 李,96045
GH10760,DERICK ACCRA(TARKWA),650,2024/6/13,KUMBALA,PICKUP MOMO STEPHANIE,2490
GH10767,GOD FIRST SS LIGHT ELECTRICALS(ACCRA),,,PRINCE B,,3000
GH10788,LARWEH SPARE PARTS(TEMA),29400,2026/2/13,BENEDICTA,"BENEDICTA,SEND TO SHOP PAY WITH 2 WEEKS",331804
GH10792,DAN.K YEBOAH(ABOSSEY OKAI),19580,2025/12/4,LINDA,"TO SHOP CREDIT,LINDA",9580
GH10799,JLARBI ABOSSEY OKAI,9010,2025/8/15,AMOAH HILDA,"PICK UP 4K CASH,5K CHEQUE,BENY",6010
GH10811,LALAS MOTORS(ABOSSEY OKAI),59516.32,2026/2/12,BOATEMAA ABIGAIL,SEND TO SHOP CHEQUE,216404.25
GH10846,MADAM GLADYS(BAAYARD),17275,2024/2/6,KUMBALA,"SEND TO SHOP,GOT THE CHEQUE",7510
GH10901,AWARZY BATTERY (ABOSSEY OKAI),57399,2025/11/14,PRINCE,TO SHOP CREDIT,36452.5
GH10912,ABRAHAMIC MOTOR(ABOSSEY OKAI),3920,2025/12/4,AMOAH HILDA,PICK UP CASH BENY,957
GH10915,JUNIOR FAN BELT(ABOSSEY OKAI),11000,2025/11/12,LINDA,TO SHOP CHEQUES,19655
GH10918,HIS MAJESTY(MADINA),56400,2024/10/30,AKORFA,TO SHOP CREDIT,6044.3
GH10922,OLUMAN(ABOSSEY OKAI),925,2026/2/13,PRINCE,"PICK UP CASH,PRINCE",3910
GH10929,PHISHERS ENTERPRISE(ABOSSEY OKAI),26500,2026/2/12,BOATEMAA ABIGAIL,SEND TO SHOP CASH,530370.6
GH10934,DERICK WELDING ELECTRODES,500,2022/11/14,PRINCE B,补单，不发货,4193
GH10973,ALEX AUTO (KUMASI),9614,2023/8/11,KOFI,PAID CASH AND SEND TO STATION,2668
GH10977,KUMAS(ASAMAN KESE),2950,2026/2/17,PRINCE B,PICK UP MOMO LATIFA,88924.69
GH10978,DAN WIREDU(KASOA),29924.5,2026/1/19,KUMBALA,PICK UP 20000 HANNAH,26584.5
GH109867,PHIFRIDAT ENT(ABOSSERY OKAI),19032,2025/10/23,LINDA,"TO SHOP CREDIT PAY WITHIN A MONTH,LINDA",0.08
GH10987,SOLLAR ENT(ABSOEEY OKAI),10034,2025/8/27,AMOAH HILDA,"PICK UP CASH,BENY",8784
GH10999,ELIK MOTORS (ABOSSY OKAI),3110,2026/2/11,AMOAH HILDA,"PICK UP CASH,HILDA",6320
GH11492,BIG JUDE MICHANTY MOTORS(TEMA),5820,2026/2/17,BENEDICTA,PICK UP CASH BY RAZAK HANNAH,52891.48
GH11903,PAUL GEES MOTORS(ABOSSEY OKAI),16684,2026/2/2,AMOAH HILDA,PICK UP 13000 CASH + CREDIT TOW WEEK PRINCE,15327
GH11952,SP MOTORS(ABOSSEY OKAI),700,2024/2/8,PRINCE,"PICKUP,MOMO",1716
GH11988,EDDY'S MOTORS(ABOSSEY OKAI),51820,2025/8/11,AMOAH HILDA,TO SHOP PAY ALL BEFORE 8.31 BENY T,25433.8
GH11999,EMILIOFRIMPS ENT (ABOSSEY OKAI),1680,2023/11/29,PRINCE,CASH PICK UP,1194
GH12239,CHIEF VENTURES,6840,2025/12/15,KOFI,"KOFI,SEND TO STATION ON CREDIT",52798
GH12342,SEIMAT TYRE (KUMASI),,,KOFI,,35450
GH123543,GEORGE BOATENG(E/RKUKURANTMI),3392,2025/12/20,LINDA,"PIC UP CASH,LINDA",454
GH16542,JACK MOTORS(ABOSSERY OKAI),22542,2025/7/17,AMOAH HILDA,"TO SHOP 20K CASH,STEPHANIE,2K CREDIT",1542
GH18542,UNITY AUTO (ADJIRINANOR),8770,2024/5/20,AKORFA,CASH PICK UP,11995
GH18786,YAW ANNAN ENT(TARKWA),14500,2026/2/5,KUMBALA,STATION 30000+15000 KUMBALA,147032.42
GH21313,TAMINI(KASOA),29315,2024/1/11,PRINCE,CASH TO SHOP,8425.3
GH21345,KEKELI BATTERIES(HOHOE),2200,2023/7/4,BENEDICTA,anthony bank's account,25040
GH23249,KING PRINCE ENT(ABBOSEY OKAI),3745,2025/8/18,AMOAH HILDA,"TO SHOP CASH,BENY",5
GH52140,GERABETT AUTO PARTS(ABOSSEY OKAI),6770,2025/9/2,BENY,PICK UP CASH BENY,6770
GH52311,TONY MOTORS(CAPE COAST),825,2026/2/3,KUMBALA,"KUMBALA,PICK UP PAY CASH",4903.5
GH53211,BOMBARIOUS ENT(KUMASI),7160,2026/1/27,KOFI,"KOFI,SEND TO STAION ON CREDIT",28610
GH76523,LIFE IN STAGES(ABOSSEY OKAI),1290,2025/7/14,LINDA,"TO SHOP CASH,LINDA",1140
GH92131,PRINCE SHOCKS(ABSOEEY OKAI),800,2026/1/22,AMOAH HILDA,PICK UP HILDA 质量问题 换货,41505
GH98517,SISTER ENTERPRISE(TEMA),36612.7,2025/12/19,BENEDICTA,"BENEDICTA,PICK UP ON CREDIT",861792.59
GH98522,ROBERT HAGAN(FOSU),69207.5,2025/11/29,KUMBALA,"KUMBALA,PICK UP WEEKLY CASH",84446.6
GH98526,BEDDISH BATTERY,32980,2025/2/4,PRINCE B,SHOP RETURN,214400
GH98531,BERNARD AKIAH HEAVY DUTY(KUMASI),3925,2026/2/12,ENOCH,TO STATION MOMO,102982
GH98540,ATO AUTOMOBILE(TARKWA),3000,2023/7/31,KUMBALA,mmo and station today,2703
GH98542,OSEI SAMPONG RIGHT HOUSE1(ABOSSEY OKAI),15495,2026/2/12,BENEDICTA,SHOP WEEKLY BENEDICTA,89525
GH98551,JAO 4 ENTERPRISE(TARKWA),4300,2023/9/29,KUMBALA,"PICKUP,GOT THE CASH",1340.8
GH98553,LOGAMA GROUPS OF COMPANIES(ABOSSEY OKAI),3840,2025/1/27,AMOAH HILDA,"CASH, PICK UP",43915
GH98554,A.PAA WLILLIE ENT(ABOSSEY OKAI),6220,2025/8/12,AMOAH HILDA,换货,0.44
GH98555,EBENEZER TETTEH(KOFORIDUA),38300,2026/1/21,PRINCE B,"LATIFA,PICK UP EVERY TWO WEEKS 12000",26300
GH98556,FRANCIS(KUMASI),6000,2026/2/9,KOFI,STATION WEEKLY 李,17020
GH98558,A.B.K RADIATORS(ABOSEY OKAI),1800,2025/2/7,PRINCE,PICK UP CASH BENY,5985.5
GH98560,KOFI SARFO(ABOSSEY OKAI),3920,2025/11/25,PRINCE,PICK UP CASH STEPH,7
GH98561,KAYZ B VENTRUES(ABOSSEY OKAI),30600,2026/1/26,PRINCE,"TO HOUSE PAY WITHIN A MONTH,ABI",30527.68
GH98562,K.MINTH ENT(ABESSEY OKAI),5920,2025/5/14,朱立刚,"PICK UP CASH,BENY",5920
GH98572,DENCEL ENT(ABOSSEY OKAI),750,2024/10/23,LINDA,PICK UP CASH,752
GH98578,FREE BOY AUTO PARTS(ABOSSEY OKAI),2000,2025/12/23,AKORFA,SEND TO SHOP MOMO STEPHNIE,51176.5
GH98584,KENZEL AUTO PARTS(ABOSSEY OKAI),1528,2025/8/5,朱立刚,PICK UP CASH,23643.14
GH98588,DORIKU BATTERY(ABOSSEY OKAI),31380,2023/11/1,AMOAH HILDA,PAY CASH 1000 AND THE REST FOR NEXT WEEK  TODAYA ND SEND TO SHOP,11190
GH98589,DANBOD TRADING ENT(AWUDOME),60200,2024/9/2,PRINCE B,SHOP CHEQUE,19904.8
GH98594,SOF PARTS(SWEDRU),12770,2026/2/17,ESTHER YEBOAH,PICK UP CREDIT LATIFA,103405
GH98598,AZAAM TRADING  AND ENGINEERING SERVICES(TEMALE),31605,2022/12/5,KUMBALA,,8905
GH98606,BUSH ENT(ABSOSSEY OKAI),6920,2025/8/5,AMOAH HILDA,SEND TO SHOP CASH,220
GH98607,BRIGHT STAR MOTORS(ABOSSEY OKAI),2200,2025/1/28,AMOAH HILDA,SEND TO SHOP CASH BENY,35142
GH98609,BAMFO MOTORS(ABOSSEY OKAI),1400,2026/2/13,AMOAH HILDA,"TO SHOP CASH,SHANG",439232.02
GH98611,PEETEE MOTORS(KUMASI),16972,2024/8/8,KOFI,CASH STATION,11304
GH98612,ERNEST MOTORS(ABOSSEY OKAI),8648,2024/5/9,BENY,CHEQUE PICK UP,0.2
GH98618,OKUMOFLO LTD(KUMASI),205704,2025/5/14,KOFI,客户4月下单时，并未查看价格，五月份客户反馈价格过高，经与客户沟通，将价格下调10%，现将单子退回，修改价格，不用出货,667435.95
GH98620,JADEN GOODS SERVICES(TEMA),52294,2026/2/17,BENEDICTA,"BENEDICTA,SEND TO SHOP ON CREDIT PAID 40000",104524
GH98623,HARUMA ADAMS(TARKWA),24110,2026/2/17,KUMBALA,STATION CREDIT KUMBALA,52131.7
GH98624,REPLACEMENT KOBBY(ABOSSEY OKAI),30000,2024/11/18,商宇琛,TO SHOP CASH,1095712
GH98634,ALEX JEN,32840,2026/1/19,PRINCE B,SHOP CREDIT PRINCE B,24310
GH98635,NIISCO AUTO,3600,2026/2/17,PRINCE,"PICK UP MOMO,SABINA",597
GH98636,PM GOD IS GREAT AUTOPART,1590,2024/11/8,BENEDICTA,MOMO PICK UP,2945
GH98641,BERMUDA MOTORS(DOME),35110.72,2026/2/13,AKORFA,"AKORFA,SEND TO STATION ON CREDIT",43864.08
GH98642,K.B MOTORS(ABOSSEY OKAI),8166,2025/3/13,PRINCE,PICK UP CASH,2718
GH98646,K-WYSE ENTERPRISE(HO),35970,2026/2/2,BENEDICTA,"BENEDICTA,PICK UP ON CREDIT",2532
GH98650,RIT K ENT(ABOSSEY OKAI),2700,2026/2/9,AMOAH HILDA,SHOP CASH HILDA,600
GH98654,FAITHFUL ARE YOU LORD ENT(TEMA),10670,2025/12/15,BENEDICTA,"BENEDICTA,PICK UP PAID CASH",71780
GH98655,RIVER HORDAN MOTORS(MADINA),18500,2026/2/17,AKORFA,"AKORFA,PICK UP ON CREDIT",16520
GH98656,ADM MOTORS (ABOSSEY OKAI),6000,2026/2/17,PRINCE,PICK UP CASH PRINCE,6000
GH98660,BEST AUTO SOLUTION (ABOSSEY OKAI),1300,2026/2/5,PRINCE,PICK UP MOMO HANNAN,2060
GH98663,RYAN LIBERTY,9075,2023/6/27,PRINCE,5k today rest next week,7595
GH98665,THY GRACE ENT-ACHIMOTA APENKWA,2138,2025/9/8,PRINCE B,SHOP,4472.2
GH98666,DELPHINA AUTO PARTS (ABOSSEY OKAI),21072.44,2023/8/30,PRINCE,cash today beny,5394.82
GH98667,NANA  NAAK VENTURES(ABOSSEY OKAI),28222,2026/1/16,PRINCE,TO SHOP PAY BEOFRE ENDING OF THE MONTH,150732
GH98668,DON MOTORS(ABOSSEY OKAI),4650,2025/2/24,BENY,SEND TO SHOP CHEQUE 补单,56257.34
GH98672,DOXA-PRICE ENTERPRISE,9079,2025/10/3,KUMBALA,"PICK UP CREDIT,LATIFA",17184
GH98676,SERVX AUTO(MADINA),10550,2026/2/9,AKORFA,SHOP CHEQUES AKORFA,10550
GH98677,BERIMA SNR AUTO PART(ABOSSEY OKAI),514,2023/10/21,BENY,"PICKUP,CASH",14
GH98680,SILVER HOUSER EXPRESS(AWUDOME),11900,2025/11/4,PRINCE B,"OBENG,PICK UP PAID MOMO",12110
GH98681,KOBBY BATTERIES(KONONGO),480,2023/11/29,KOFI,MOMO PICK UP,2590
GH98684,PSALMMI BEE ENT.(ODORKOR),84400,2025/12/29,KUMBALA,TO SHOP CREDIT,69735
GH98687,KWAME ASANTE(ABOSSEY OKAI),7000,2025/2/25,PRINCE,PICK UP CASH,2800
GH98691,FNG AUTO PARTS(ODONAR),1770,2024/2/6,KUMBALA,"PICKUP,MOMO",6066
GH98696,CASO ESPECIAL (特殊）,8048,2025/1/16,AMOAH HILDA,"CASH, PICK UP",6426
GH98700,YAW APP MOTORS(ABOSSEY OKAI),1230,2024/12/19,BENY,PICK UP MOMO,2828
GH98706,EMMANUEL MOTTORS(TABORA),2150,2025/11/28,AKORFA,"SYLVIA,PICK UP PAID CASH",990
GH98708,KESEWAA AUTO(TIAFA JUNCTION),1380,2024/9/17,PRINCE B,TO SHOP CREDIT OBENG,3085
GH98711,KINGS AUTO PART(ABOSSEY OKAI),16493,2024/7/18,PRINCE,TO SHOP PAY WITH IN ONE MONTH,9977
GH98716,ERICO ALIGNMENT SUSPENSION(OYARIFA TEIM),2800,2024/1/5,BENEDICTA,MOMO PICK UP,3168
GH98718,A.J.ENT(KASOA STATION),2500,2025/3/7,AKORFA,PICK UP REPLACE,16352
GH98721,RIGHTEOUS ONE MOTORS(ABBOSEY OKAI),10784,2025/8/8,AMOAH HILDA,"PICK UP PAY IN TWO WEEKS,BENY",5784
GH98723,O.C CALIVIC(TEMA),24000,2026/2/2,BENEDICTA,"BENEDICTA,SEND TO SHOP ON CREDIT",70680
GH98727,DACOSPONG CO LTD.（ABOSSEY OKAI）,908,2026/2/5,PRINCE B,"LATIFA,PICK UP ON CREDIT",70802.5
GH98739,EVANS VUKEY ENT(ABOSSEY OKAI),720,2024/12/30,LINDA,PICK UP CASH,711
GH98740,BRIGHT YIADOM (ACHIMOTA),5784,2026/1/31,PRINCE B,"STEPHAINE,PICK UP PAY MOMO",47683.03
GH98745,RHEMA BATTERIES (LAPAZ ACCRA),50100,2024/9/2,AKORFA,TO SHOP CREDIT SYLVIA,48467
GH98746,Tawala Auto parts(ABOSSEY OKAI),37312,2024/3/26,AMOAH HILDA,PICK UP CASH AND CHEQUE,16272
GH98748,ADAMU ENT(ABOSSEY OKAI),7628,2025/3/14,PRINCE,"TO SHOP CASH,BENY",1535
